{
  "anchors": [
    {
      "at": [
        2,
        0
      ],
      "dir": "E",
      "id": "link"
    }
  ],
  "body_box": [
    [
      -2,
      -3
    ],
    [
      2,
      3
    ]
  ],
  "elements": [
    {
      "line": [
        [
          0,
          -3
        ],
        [
          0,
          -1
        ]
      ],
      "style": "solid",
      "weight": "normal"
    },
    {
      "line": [
        [
          0,
          3
        ],
        [
          0,
          1
        ]
      ],
      "style": "solid",
      "weight": "normal"
    },
    {
      "closed": true,
      "fill": "none",
      "polyline": [
        [
          -2,
          -1
        ],
        [
          2,
          -1
        ],
        [
          2,
          1
        ],
        [
          -2,
          1
        ]
      ],
      "style": "solid",
      "weight": "normal"
    }
  ],
  "keepout_box": [
    [
      -2,
      -3
    ],
    [
      2,
      3
    ]
  ],
  "kind": "symbol",
  "name": "Operating device, general symbol; relay coil, general symbol",
  "nodes": [
    {
      "ports": [
        "in"
      ]
    },
    {
      "ports": [
        "out"
      ]
    }
  ],
  "paths": [
    {
      "from": "in",
      "kind": "impedance",
      "through": true,
      "to": "out"
    }
  ],
  "ports": [
    {
      "at": [
        0,
        -3
      ],
      "description": "",
      "dir": "N",
      "id": "in"
    },
    {
      "at": [
        0,
        3
      ],
      "description": "",
      "dir": "S",
      "id": "out"
    }
  ],
  "reference": {
    "number": "relay-coil",
    "standard": "Example set"
  },
  "schema": 1,
  "slots": {
    "marking.in": {
      "at": [
        0.25,
        -2
      ],
      "box": [
        1.5,
        1
      ],
      "side": "E"
    },
    "marking.out": {
      "at": [
        0.25,
        2
      ],
      "box": [
        1.5,
        1
      ],
      "side": "E"
    },
    "tag": {
      "at": [
        -2.5,
        0
      ],
      "box": [
        6,
        1
      ],
      "side": "W"
    }
  },
  "status": "unverified"
}
