{
  "anchors": [
    {
      "at": [
        -0.5,
        0
      ],
      "dir": "W",
      "id": "link"
    }
  ],
  "body_box": [
    [
      -2,
      -2
    ],
    [
      0,
      2
    ]
  ],
  "elements": [
    {
      "line": [
        [
          0,
          2
        ],
        [
          0,
          1
        ]
      ],
      "style": "solid",
      "weight": "normal"
    },
    {
      "line": [
        [
          0,
          -2
        ],
        [
          0,
          -1
        ]
      ],
      "style": "solid",
      "weight": "normal"
    },
    {
      "line": [
        [
          -2,
          -2
        ],
        [
          -2,
          -1
        ]
      ],
      "style": "solid",
      "weight": "normal"
    },
    {
      "line": [
        [
          -2,
          -1
        ],
        [
          -1,
          -1
        ]
      ],
      "style": "solid",
      "weight": "normal"
    },
    {
      "line": [
        [
          0,
          1
        ],
        [
          -1.125,
          -1.25
        ]
      ],
      "style": "solid",
      "weight": "normal"
    }
  ],
  "keepout_box": [
    [
      -2,
      -2
    ],
    [
      0,
      2
    ]
  ],
  "kind": "symbol",
  "name": "Change-over break before make contact",
  "nodes": [
    {
      "ports": [
        "1.com"
      ]
    },
    {
      "ports": [
        "1.no"
      ]
    },
    {
      "ports": [
        "1.nc"
      ]
    }
  ],
  "paths": [
    {
      "from": "1.no",
      "kind": "switch_open",
      "through": true,
      "to": "1.com"
    },
    {
      "from": "1.nc",
      "kind": "switch_closed",
      "through": false,
      "to": "1.com"
    }
  ],
  "pole_pitch": 8,
  "ports": [
    {
      "at": [
        0,
        2
      ],
      "description": "common",
      "dir": "S",
      "id": "1.com"
    },
    {
      "at": [
        0,
        -2
      ],
      "description": "closes on actuation",
      "dir": "N",
      "id": "1.no"
    },
    {
      "at": [
        -2,
        -2
      ],
      "description": "opens on actuation",
      "dir": "N",
      "id": "1.nc"
    }
  ],
  "reference": {
    "number": "S00230",
    "standard": "Example set"
  },
  "schema": 1,
  "slots": {
    "1.tag": {
      "at": [
        -4,
        0
      ],
      "box": [
        6,
        1
      ],
      "side": "W"
    },
    "marking.1.com": {
      "at": [
        0.25,
        1.5
      ],
      "box": [
        1.5,
        1
      ],
      "side": "E"
    },
    "marking.1.nc": {
      "at": [
        -2.25,
        -1.5
      ],
      "box": [
        1.5,
        1
      ],
      "side": "W"
    },
    "marking.1.no": {
      "at": [
        0.25,
        -1.5
      ],
      "box": [
        1.5,
        1
      ],
      "side": "E"
    }
  },
  "status": "unverified"
}
