{
  "anchors": [],
  "body_box": [
    [
      -1,
      -2
    ],
    [
      7,
      2
    ]
  ],
  "elements": [
    {
      "line": [
        [
          0,
          -2
        ],
        [
          0,
          -1
        ]
      ],
      "style": "solid",
      "weight": "normal"
    },
    {
      "line": [
        [
          0,
          2
        ],
        [
          0,
          1
        ]
      ],
      "style": "solid",
      "weight": "normal"
    },
    {
      "circle": [
        0,
        0
      ],
      "fill": "none",
      "r": 1,
      "weight": "normal"
    },
    {
      "closed": true,
      "fill": "none",
      "polyline": [
        [
          -0.5,
          -0.375
        ],
        [
          0.5,
          -0.375
        ],
        [
          0,
          0.5
        ]
      ],
      "style": "solid",
      "weight": "normal"
    },
    {
      "line": [
        [
          2,
          -2
        ],
        [
          2,
          -1
        ]
      ],
      "style": "solid",
      "weight": "normal"
    },
    {
      "line": [
        [
          2,
          2
        ],
        [
          2,
          1
        ]
      ],
      "style": "solid",
      "weight": "normal"
    },
    {
      "circle": [
        2,
        0
      ],
      "fill": "none",
      "r": 1,
      "weight": "normal"
    },
    {
      "closed": true,
      "fill": "none",
      "polyline": [
        [
          1.5,
          -0.375
        ],
        [
          2.5,
          -0.375
        ],
        [
          2,
          0.5
        ]
      ],
      "style": "solid",
      "weight": "normal"
    },
    {
      "line": [
        [
          4,
          -2
        ],
        [
          4,
          -1
        ]
      ],
      "style": "solid",
      "weight": "normal"
    },
    {
      "line": [
        [
          4,
          2
        ],
        [
          4,
          1
        ]
      ],
      "style": "solid",
      "weight": "normal"
    },
    {
      "circle": [
        4,
        0
      ],
      "fill": "none",
      "r": 1,
      "weight": "normal"
    },
    {
      "closed": true,
      "fill": "none",
      "polyline": [
        [
          3.5,
          -0.375
        ],
        [
          4.5,
          -0.375
        ],
        [
          4,
          0.5
        ]
      ],
      "style": "solid",
      "weight": "normal"
    },
    {
      "line": [
        [
          6,
          -2
        ],
        [
          6,
          -1
        ]
      ],
      "style": "solid",
      "weight": "normal"
    },
    {
      "line": [
        [
          6,
          2
        ],
        [
          6,
          1
        ]
      ],
      "style": "solid",
      "weight": "normal"
    },
    {
      "circle": [
        6,
        0
      ],
      "fill": "none",
      "r": 1,
      "weight": "normal"
    },
    {
      "closed": true,
      "fill": "none",
      "polyline": [
        [
          5.5,
          -0.375
        ],
        [
          6.5,
          -0.375
        ],
        [
          6,
          0.5
        ]
      ],
      "style": "solid",
      "weight": "normal"
    }
  ],
  "keepout_box": [
    [
      -1,
      -2
    ],
    [
      7,
      2
    ]
  ],
  "kind": "symbol",
  "name": "Pump",
  "nodes": [
    {
      "ports": [
        "1.in"
      ]
    },
    {
      "ports": [
        "1.out"
      ]
    },
    {
      "ports": [
        "2.in"
      ]
    },
    {
      "ports": [
        "2.out"
      ]
    },
    {
      "ports": [
        "3.in"
      ]
    },
    {
      "ports": [
        "3.out"
      ]
    },
    {
      "ports": [
        "4.in"
      ]
    },
    {
      "ports": [
        "4.out"
      ]
    }
  ],
  "paths": [
    {
      "from": "1.in",
      "kind": "pipe",
      "through": true,
      "to": "1.out"
    },
    {
      "from": "2.in",
      "kind": "pipe",
      "through": false,
      "to": "2.out"
    },
    {
      "from": "3.in",
      "kind": "pipe",
      "through": false,
      "to": "3.out"
    },
    {
      "from": "4.in",
      "kind": "pipe",
      "through": false,
      "to": "4.out"
    }
  ],
  "ports": [
    {
      "at": [
        0,
        -2
      ],
      "description": "",
      "dir": "N",
      "id": "1.in"
    },
    {
      "at": [
        0,
        2
      ],
      "description": "",
      "dir": "S",
      "id": "1.out"
    },
    {
      "at": [
        2,
        -2
      ],
      "description": "",
      "dir": "N",
      "id": "2.in"
    },
    {
      "at": [
        2,
        2
      ],
      "description": "",
      "dir": "S",
      "id": "2.out"
    },
    {
      "at": [
        4,
        -2
      ],
      "description": "",
      "dir": "N",
      "id": "3.in"
    },
    {
      "at": [
        4,
        2
      ],
      "description": "",
      "dir": "S",
      "id": "3.out"
    },
    {
      "at": [
        6,
        -2
      ],
      "description": "",
      "dir": "N",
      "id": "4.in"
    },
    {
      "at": [
        6,
        2
      ],
      "description": "",
      "dir": "S",
      "id": "4.out"
    }
  ],
  "reference": {
    "number": "S90002",
    "standard": "Example set"
  },
  "schema": 1,
  "slots": {
    "1.tag": {
      "at": [
        -1.5,
        0
      ],
      "box": [
        6,
        1
      ],
      "side": "W"
    },
    "2.tag": {
      "at": [
        0.5,
        0
      ],
      "box": [
        6,
        1
      ],
      "side": "W"
    },
    "3.tag": {
      "at": [
        2.5,
        0
      ],
      "box": [
        6,
        1
      ],
      "side": "W"
    },
    "4.tag": {
      "at": [
        4.5,
        0
      ],
      "box": [
        6,
        1
      ],
      "side": "W"
    },
    "marking.1.in": {
      "at": [
        1.25,
        -1.5
      ],
      "box": [
        1.5,
        1
      ],
      "side": "E"
    },
    "marking.1.out": {
      "at": [
        1.25,
        1.5
      ],
      "box": [
        1.5,
        1
      ],
      "side": "E"
    },
    "marking.2.in": {
      "at": [
        3.25,
        -1.5
      ],
      "box": [
        1.5,
        1
      ],
      "side": "E"
    },
    "marking.2.out": {
      "at": [
        3.25,
        1.5
      ],
      "box": [
        1.5,
        1
      ],
      "side": "E"
    },
    "marking.3.in": {
      "at": [
        5.25,
        -1.5
      ],
      "box": [
        1.5,
        1
      ],
      "side": "E"
    },
    "marking.3.out": {
      "at": [
        5.25,
        1.5
      ],
      "box": [
        1.5,
        1
      ],
      "side": "E"
    },
    "marking.4.in": {
      "at": [
        7.25,
        -1.5
      ],
      "box": [
        1.5,
        1
      ],
      "side": "E"
    },
    "marking.4.out": {
      "at": [
        7.25,
        1.5
      ],
      "box": [
        1.5,
        1
      ],
      "side": "E"
    }
  },
  "status": "unverified"
}
