{
  "anchors": [
    {
      "at": [
        0,
        0
      ],
      "dir": "E",
      "id": "link"
    }
  ],
  "body_box": [
    [
      -0.75,
      -0.5
    ],
    [
      0,
      0.5
    ]
  ],
  "elements": [
    {
      "line": [
        [
          0,
          -0.5
        ],
        [
          0,
          0.5
        ]
      ],
      "style": "solid",
      "weight": "normal"
    },
    {
      "line": [
        [
          0,
          0
        ],
        [
          -0.75,
          0
        ]
      ],
      "style": "solid",
      "weight": "normal"
    }
  ],
  "keepout_box": [
    [
      -0.75,
      -0.5
    ],
    [
      0,
      0.5
    ]
  ],
  "kind": "qualifier",
  "name": "Operated by pushing",
  "nodes": [],
  "paths": [],
  "ports": [],
  "reference": {
    "number": "operated-by-pushing",
    "standard": "Example set"
  },
  "schema": 1,
  "slots": {},
  "status": "unverified"
}
