{
  "anchors": [
    {
      "at": [
        2,
        0
      ],
      "dir": "E",
      "id": "link"
    }
  ],
  "body_box": [
    [
      -2,
      -3
    ],
    [
      14,
      3
    ]
  ],
  "elements": [
    {
      "line": [
        [
          0,
          -3
        ],
        [
          0,
          -1
        ]
      ],
      "style": "solid",
      "weight": "normal"
    },
    {
      "line": [
        [
          0,
          3
        ],
        [
          0,
          1
        ]
      ],
      "style": "solid",
      "weight": "normal"
    },
    {
      "closed": true,
      "fill": "none",
      "polyline": [
        [
          -2,
          -1
        ],
        [
          2,
          -1
        ],
        [
          2,
          1
        ],
        [
          -2,
          1
        ]
      ],
      "style": "solid",
      "weight": "normal"
    },
    {
      "line": [
        [
          4,
          -3
        ],
        [
          4,
          -1
        ]
      ],
      "style": "solid",
      "weight": "normal"
    },
    {
      "line": [
        [
          4,
          3
        ],
        [
          4,
          1
        ]
      ],
      "style": "solid",
      "weight": "normal"
    },
    {
      "closed": true,
      "fill": "none",
      "polyline": [
        [
          2,
          -1
        ],
        [
          6,
          -1
        ],
        [
          6,
          1
        ],
        [
          2,
          1
        ]
      ],
      "style": "solid",
      "weight": "normal"
    },
    {
      "line": [
        [
          8,
          -3
        ],
        [
          8,
          -1
        ]
      ],
      "style": "solid",
      "weight": "normal"
    },
    {
      "line": [
        [
          8,
          3
        ],
        [
          8,
          1
        ]
      ],
      "style": "solid",
      "weight": "normal"
    },
    {
      "closed": true,
      "fill": "none",
      "polyline": [
        [
          6,
          -1
        ],
        [
          10,
          -1
        ],
        [
          10,
          1
        ],
        [
          6,
          1
        ]
      ],
      "style": "solid",
      "weight": "normal"
    },
    {
      "line": [
        [
          12,
          -3
        ],
        [
          12,
          -1
        ]
      ],
      "style": "solid",
      "weight": "normal"
    },
    {
      "line": [
        [
          12,
          3
        ],
        [
          12,
          1
        ]
      ],
      "style": "solid",
      "weight": "normal"
    },
    {
      "closed": true,
      "fill": "none",
      "polyline": [
        [
          10,
          -1
        ],
        [
          14,
          -1
        ],
        [
          14,
          1
        ],
        [
          10,
          1
        ]
      ],
      "style": "solid",
      "weight": "normal"
    }
  ],
  "keepout_box": [
    [
      -2,
      -3
    ],
    [
      14,
      3
    ]
  ],
  "kind": "symbol",
  "name": "Operating device, general symbol; relay coil, general symbol",
  "nodes": [
    {
      "ports": [
        "1.in"
      ]
    },
    {
      "ports": [
        "1.out"
      ]
    },
    {
      "ports": [
        "2.in"
      ]
    },
    {
      "ports": [
        "2.out"
      ]
    },
    {
      "ports": [
        "3.in"
      ]
    },
    {
      "ports": [
        "3.out"
      ]
    },
    {
      "ports": [
        "4.in"
      ]
    },
    {
      "ports": [
        "4.out"
      ]
    }
  ],
  "paths": [
    {
      "from": "1.in",
      "kind": "impedance",
      "through": true,
      "to": "1.out"
    },
    {
      "from": "2.in",
      "kind": "impedance",
      "through": false,
      "to": "2.out"
    },
    {
      "from": "3.in",
      "kind": "impedance",
      "through": false,
      "to": "3.out"
    },
    {
      "from": "4.in",
      "kind": "impedance",
      "through": false,
      "to": "4.out"
    }
  ],
  "ports": [
    {
      "at": [
        0,
        -3
      ],
      "description": "",
      "dir": "N",
      "id": "1.in"
    },
    {
      "at": [
        0,
        3
      ],
      "description": "",
      "dir": "S",
      "id": "1.out"
    },
    {
      "at": [
        4,
        -3
      ],
      "description": "",
      "dir": "N",
      "id": "2.in"
    },
    {
      "at": [
        4,
        3
      ],
      "description": "",
      "dir": "S",
      "id": "2.out"
    },
    {
      "at": [
        8,
        -3
      ],
      "description": "",
      "dir": "N",
      "id": "3.in"
    },
    {
      "at": [
        8,
        3
      ],
      "description": "",
      "dir": "S",
      "id": "3.out"
    },
    {
      "at": [
        12,
        -3
      ],
      "description": "",
      "dir": "N",
      "id": "4.in"
    },
    {
      "at": [
        12,
        3
      ],
      "description": "",
      "dir": "S",
      "id": "4.out"
    }
  ],
  "reference": {
    "number": "S00305",
    "standard": "IEC 60617"
  },
  "schema": 1,
  "slots": {
    "1.tag": {
      "at": [
        -2.5,
        0
      ],
      "box": [
        6,
        1
      ],
      "side": "W"
    },
    "2.tag": {
      "at": [
        1.5,
        0
      ],
      "box": [
        6,
        1
      ],
      "side": "W"
    },
    "3.tag": {
      "at": [
        5.5,
        0
      ],
      "box": [
        6,
        1
      ],
      "side": "W"
    },
    "4.tag": {
      "at": [
        9.5,
        0
      ],
      "box": [
        6,
        1
      ],
      "side": "W"
    },
    "marking.1.in": {
      "at": [
        0.25,
        -2
      ],
      "box": [
        1.5,
        1
      ],
      "side": "E"
    },
    "marking.1.out": {
      "at": [
        0.25,
        2
      ],
      "box": [
        1.5,
        1
      ],
      "side": "E"
    },
    "marking.2.in": {
      "at": [
        4.25,
        -2
      ],
      "box": [
        1.5,
        1
      ],
      "side": "E"
    },
    "marking.2.out": {
      "at": [
        4.25,
        2
      ],
      "box": [
        1.5,
        1
      ],
      "side": "E"
    },
    "marking.3.in": {
      "at": [
        8.25,
        -2
      ],
      "box": [
        1.5,
        1
      ],
      "side": "E"
    },
    "marking.3.out": {
      "at": [
        8.25,
        2
      ],
      "box": [
        1.5,
        1
      ],
      "side": "E"
    },
    "marking.4.in": {
      "at": [
        12.25,
        -2
      ],
      "box": [
        1.5,
        1
      ],
      "side": "E"
    },
    "marking.4.out": {
      "at": [
        12.25,
        2
      ],
      "box": [
        1.5,
        1
      ],
      "side": "E"
    }
  },
  "status": "unverified"
}
