{
  "anchors": [
    {
      "at": [
        -0.5,
        0
      ],
      "dir": "W",
      "id": "link"
    }
  ],
  "body_box": [
    [
      -1,
      -2
    ],
    [
      0,
      2
    ]
  ],
  "elements": [
    {
      "line": [
        [
          0,
          -2
        ],
        [
          0,
          -1
        ]
      ],
      "style": "solid",
      "weight": "normal"
    },
    {
      "line": [
        [
          0,
          2
        ],
        [
          0,
          1
        ]
      ],
      "style": "solid",
      "weight": "normal"
    },
    {
      "line": [
        [
          0,
          1
        ],
        [
          -1,
          -1
        ]
      ],
      "style": "solid",
      "weight": "normal"
    }
  ],
  "keepout_box": [
    [
      -1,
      -2
    ],
    [
      0,
      2
    ]
  ],
  "kind": "symbol",
  "name": "Make contact, general symbol",
  "nodes": [
    {
      "ports": [
        "1.in"
      ]
    },
    {
      "ports": [
        "1.out"
      ]
    }
  ],
  "paths": [
    {
      "from": "1.in",
      "kind": "switch_open",
      "through": true,
      "to": "1.out"
    }
  ],
  "ports": [
    {
      "at": [
        0,
        -2
      ],
      "description": "",
      "dir": "N",
      "id": "1.in"
    },
    {
      "at": [
        0,
        2
      ],
      "description": "",
      "dir": "S",
      "id": "1.out"
    }
  ],
  "reference": {
    "number": "make-contact",
    "standard": "Example set"
  },
  "schema": 1,
  "slots": {
    "1.tag": {
      "at": [
        -1.5,
        0
      ],
      "box": [
        6,
        1
      ],
      "side": "W"
    },
    "marking.1.in": {
      "at": [
        0.25,
        -1.5
      ],
      "box": [
        1.5,
        1
      ],
      "side": "E"
    },
    "marking.1.out": {
      "at": [
        0.25,
        1.5
      ],
      "box": [
        1.5,
        1
      ],
      "side": "E"
    }
  },
  "status": "unverified"
}
