{
  "anchors": [],
  "body_box": [
    [
      -1,
      -2
    ],
    [
      1,
      2
    ]
  ],
  "elements": [
    {
      "line": [
        [
          0,
          -2
        ],
        [
          0,
          -0.75
        ]
      ],
      "style": "solid",
      "weight": "normal"
    },
    {
      "line": [
        [
          -1,
          -0.75
        ],
        [
          1,
          -0.75
        ]
      ],
      "style": "solid",
      "weight": "normal"
    },
    {
      "circle": [
        0,
        0
      ],
      "fill": "none",
      "r": 0.75,
      "weight": "normal"
    },
    {
      "line": [
        [
          0,
          2
        ],
        [
          0,
          0.75
        ]
      ],
      "style": "solid",
      "weight": "normal"
    }
  ],
  "keepout_box": [
    [
      -1,
      -2
    ],
    [
      1,
      2
    ]
  ],
  "kind": "symbol",
  "name": "Check valve",
  "nodes": [
    {
      "ports": [
        "in"
      ]
    },
    {
      "ports": [
        "out"
      ]
    }
  ],
  "paths": [
    {
      "from": "in",
      "kind": "pipe",
      "through": true,
      "to": "out"
    }
  ],
  "ports": [
    {
      "at": [
        0,
        -2
      ],
      "description": "",
      "dir": "N",
      "id": "in"
    },
    {
      "at": [
        0,
        2
      ],
      "description": "",
      "dir": "S",
      "id": "out"
    }
  ],
  "reference": {
    "number": "check-valve",
    "standard": "Example set"
  },
  "schema": 1,
  "slots": {
    "marking.in": {
      "at": [
        1.25,
        -1.5
      ],
      "box": [
        1.5,
        1
      ],
      "side": "E"
    },
    "marking.out": {
      "at": [
        1.25,
        1.5
      ],
      "box": [
        1.5,
        1
      ],
      "side": "E"
    },
    "tag": {
      "at": [
        -1.5,
        0
      ],
      "box": [
        6,
        1
      ],
      "side": "W"
    }
  },
  "status": "unverified"
}
