{
  "anchors": [],
  "body_box": [
    [
      -3.25,
      -2
    ],
    [
      0,
      14
    ]
  ],
  "elements": [
    {
      "line": [
        [
          0,
          -2
        ],
        [
          0,
          -1
        ]
      ],
      "style": "solid",
      "weight": "normal"
    },
    {
      "line": [
        [
          0,
          2
        ],
        [
          0,
          1
        ]
      ],
      "style": "solid",
      "weight": "normal"
    },
    {
      "line": [
        [
          0,
          1
        ],
        [
          -1,
          -1
        ]
      ],
      "style": "solid",
      "weight": "normal"
    },
    {
      "line": [
        [
          -0.5,
          0
        ],
        [
          -2.5,
          0
        ]
      ],
      "style": "dashed",
      "weight": "normal"
    },
    {
      "line": [
        [
          -2.5,
          -0.5
        ],
        [
          -2.5,
          0.5
        ]
      ],
      "style": "solid",
      "weight": "normal"
    },
    {
      "line": [
        [
          -2.5,
          0
        ],
        [
          -3.25,
          0
        ]
      ],
      "style": "solid",
      "weight": "normal"
    },
    {
      "line": [
        [
          0,
          2
        ],
        [
          0,
          3
        ]
      ],
      "style": "solid",
      "weight": "normal"
    },
    {
      "line": [
        [
          0,
          6
        ],
        [
          0,
          5
        ]
      ],
      "style": "solid",
      "weight": "normal"
    },
    {
      "line": [
        [
          0,
          5
        ],
        [
          -1,
          3
        ]
      ],
      "style": "solid",
      "weight": "normal"
    },
    {
      "line": [
        [
          -0.5,
          4
        ],
        [
          -2.5,
          4
        ]
      ],
      "style": "dashed",
      "weight": "normal"
    },
    {
      "line": [
        [
          -2.5,
          3.5
        ],
        [
          -2.5,
          4.5
        ]
      ],
      "style": "solid",
      "weight": "normal"
    },
    {
      "line": [
        [
          -2.5,
          4
        ],
        [
          -3.25,
          4
        ]
      ],
      "style": "solid",
      "weight": "normal"
    },
    {
      "line": [
        [
          0,
          6
        ],
        [
          0,
          7
        ]
      ],
      "style": "solid",
      "weight": "normal"
    },
    {
      "line": [
        [
          0,
          10
        ],
        [
          0,
          9
        ]
      ],
      "style": "solid",
      "weight": "normal"
    },
    {
      "line": [
        [
          0,
          9
        ],
        [
          -1,
          7
        ]
      ],
      "style": "solid",
      "weight": "normal"
    },
    {
      "line": [
        [
          -0.5,
          8
        ],
        [
          -2.5,
          8
        ]
      ],
      "style": "dashed",
      "weight": "normal"
    },
    {
      "line": [
        [
          -2.5,
          7.5
        ],
        [
          -2.5,
          8.5
        ]
      ],
      "style": "solid",
      "weight": "normal"
    },
    {
      "line": [
        [
          -2.5,
          8
        ],
        [
          -3.25,
          8
        ]
      ],
      "style": "solid",
      "weight": "normal"
    },
    {
      "line": [
        [
          0,
          10
        ],
        [
          0,
          11
        ]
      ],
      "style": "solid",
      "weight": "normal"
    },
    {
      "line": [
        [
          0,
          14
        ],
        [
          0,
          13
        ]
      ],
      "style": "solid",
      "weight": "normal"
    },
    {
      "line": [
        [
          0,
          13
        ],
        [
          -1,
          11
        ]
      ],
      "style": "solid",
      "weight": "normal"
    },
    {
      "line": [
        [
          -0.5,
          12
        ],
        [
          -2.5,
          12
        ]
      ],
      "style": "dashed",
      "weight": "normal"
    },
    {
      "line": [
        [
          -2.5,
          11.5
        ],
        [
          -2.5,
          12.5
        ]
      ],
      "style": "solid",
      "weight": "normal"
    },
    {
      "line": [
        [
          -2.5,
          12
        ],
        [
          -3.25,
          12
        ]
      ],
      "style": "solid",
      "weight": "normal"
    }
  ],
  "keepout_box": [
    [
      -3.25,
      -2
    ],
    [
      0,
      14
    ]
  ],
  "kind": "symbol",
  "name": "Switch, manually operated, push-button, automatic return",
  "nodes": [
    {
      "ports": [
        "1.in"
      ]
    },
    {
      "ports": [
        "1.out"
      ]
    },
    {
      "ports": [
        "2.in"
      ]
    },
    {
      "ports": [
        "2.out"
      ]
    },
    {
      "ports": [
        "3.in"
      ]
    },
    {
      "ports": [
        "3.out"
      ]
    },
    {
      "ports": [
        "4.in"
      ]
    },
    {
      "ports": [
        "4.out"
      ]
    }
  ],
  "paths": [
    {
      "from": "1.in",
      "kind": "switch_open",
      "through": true,
      "to": "1.out"
    },
    {
      "from": "2.in",
      "kind": "switch_open",
      "through": false,
      "to": "2.out"
    },
    {
      "from": "3.in",
      "kind": "switch_open",
      "through": false,
      "to": "3.out"
    },
    {
      "from": "4.in",
      "kind": "switch_open",
      "through": false,
      "to": "4.out"
    }
  ],
  "pole_pitch": 8,
  "ports": [
    {
      "at": [
        0,
        -2
      ],
      "description": "",
      "dir": "N",
      "id": "1.in"
    },
    {
      "at": [
        0,
        2
      ],
      "description": "",
      "dir": "S",
      "id": "1.out"
    },
    {
      "at": [
        0,
        2
      ],
      "description": "",
      "dir": "N",
      "id": "2.in"
    },
    {
      "at": [
        0,
        6
      ],
      "description": "",
      "dir": "S",
      "id": "2.out"
    },
    {
      "at": [
        0,
        6
      ],
      "description": "",
      "dir": "N",
      "id": "3.in"
    },
    {
      "at": [
        0,
        10
      ],
      "description": "",
      "dir": "S",
      "id": "3.out"
    },
    {
      "at": [
        0,
        10
      ],
      "description": "",
      "dir": "N",
      "id": "4.in"
    },
    {
      "at": [
        0,
        14
      ],
      "description": "",
      "dir": "S",
      "id": "4.out"
    }
  ],
  "reference": {
    "number": "push-button",
    "standard": "Example set"
  },
  "schema": 1,
  "slots": {
    "1.tag": {
      "at": [
        -3.5,
        0
      ],
      "box": [
        6,
        1
      ],
      "side": "W"
    },
    "2.tag": {
      "at": [
        -3.5,
        4
      ],
      "box": [
        6,
        1
      ],
      "side": "W"
    },
    "3.tag": {
      "at": [
        -3.5,
        8
      ],
      "box": [
        6,
        1
      ],
      "side": "W"
    },
    "4.tag": {
      "at": [
        -3.5,
        12
      ],
      "box": [
        6,
        1
      ],
      "side": "W"
    },
    "marking.1.in": {
      "at": [
        0.25,
        -1.5
      ],
      "box": [
        1.5,
        1
      ],
      "side": "E"
    },
    "marking.1.out": {
      "at": [
        0.25,
        1.5
      ],
      "box": [
        1.5,
        1
      ],
      "side": "E"
    },
    "marking.2.in": {
      "at": [
        0.25,
        2.5
      ],
      "box": [
        1.5,
        1
      ],
      "side": "E"
    },
    "marking.2.out": {
      "at": [
        0.25,
        5.5
      ],
      "box": [
        1.5,
        1
      ],
      "side": "E"
    },
    "marking.3.in": {
      "at": [
        0.25,
        6.5
      ],
      "box": [
        1.5,
        1
      ],
      "side": "E"
    },
    "marking.3.out": {
      "at": [
        0.25,
        9.5
      ],
      "box": [
        1.5,
        1
      ],
      "side": "E"
    },
    "marking.4.in": {
      "at": [
        0.25,
        10.5
      ],
      "box": [
        1.5,
        1
      ],
      "side": "E"
    },
    "marking.4.out": {
      "at": [
        0.25,
        13.5
      ],
      "box": [
        1.5,
        1
      ],
      "side": "E"
    }
  },
  "status": "unverified"
}
